{
  "schemaVersion": 1,
  "planDigest": "7f9b6d6f5c17e80649e42fefd860f476160be6bd1a809511543e4a27814e5454",
  "candidateSha": "0000000000000000000000000000000000000000",
  "deployedSha": "0000000000000000000000000000000000000000",
  "actor": "REPLACE_WITH_OPERATOR_ID",
  "occurredAt": "2026-01-01T00:00:00.000Z",
  "target": { "system": "REPLACE_WITH_SYSTEM", "environment": "REPLACE_WITH_ENVIRONMENT", "providerObjectIds": ["REPLACE_WITH_IMMUTABLE_PROVIDER_OBJECT_ID"] },
  "priorState": { "stateReceiptId": "REPLACE_WITH_PRIOR_METADATA_RECEIPT", "stateDigest": "0000000000000000000000000000000000000000000000000000000000000000" },
  "newState": { "stateReceiptId": "REPLACE_WITH_NEW_METADATA_RECEIPT", "stateDigest": "0000000000000000000000000000000000000000000000000000000000000000" },
  "verification": [{ "check": "REPLACE_WITH_CHECK", "result": "pass", "evidenceId": "REPLACE_WITH_EVIDENCE_ID" }],
  "rollback": { "handle": "REPLACE_WITH_IMMUTABLE_ROLLBACK_ID", "procedure": "REPLACE_WITH_APPROVED_RUNBOOK_STEP" }
}
